{
  "schemaVersion": "pair-qualification-run-v0.1",
  "systemName": "integrated",
  "version": "integrated-v0.1",
  "model": "deterministic+SCIR+patch-effects+intent-retrieval",
  "promptSha256": "cdb13e4fe49ccc79ac2f8555b0743ac304cfb0aee11dc22c712c9658687c44f6",
  "startedAt": "2026-07-17T02:55:41.129Z",
  "finishedAt": "2026-07-17T02:55:47.725Z",
  "totalLatencyMs": 6596.007417,
  "totalTokens": 0,
  "totalCostUsd": 0,
  "failedCases": 0,
  "notes": "Local deterministic run on the frozen suite."
}
